[
  {
    "doc_id": "KB-0001",
    "title": "产品版本差异（模拟）",
    "knowledge_domain": "product",
    "product_line": "模拟标准产品线",
    "applicable_roles": [
      "doctor",
      "assistant",
      "support"
    ],
    "risk_level": "low",
    "effective_date": "2026-01-01",
    "expires_at": null,
    "version": "1.1.0",
    "status": "active",
    "content": "这是关于产品版本差异的虚构知识条目，仅用于检索、引用和边界测试，不构成真实产品或临床建议。",
    "mock_reference": "mock://knowledge/product/1"
  },
  {
    "doc_id": "KB-0002",
    "title": "适用范围（模拟）",
    "knowledge_domain": "product",
    "product_line": "模拟标准产品线",
    "applicable_roles": [
      "doctor",
      "assistant",
      "support"
    ],
    "risk_level": "low",
    "effective_date": "2026-01-01",
    "expires_at": null,
    "version": "1.2.0",
    "status": "active",
    "content": "这是关于适用范围的虚构知识条目，仅用于检索、引用和边界测试，不构成真实产品或临床建议。",
    "mock_reference": "mock://knowledge/product/2"
  },
  {
    "doc_id": "KB-0003",
    "title": "包装与标识（模拟）",
    "knowledge_domain": "product",
    "product_line": "模拟标准产品线",
    "applicable_roles": [
      "doctor",
      "assistant",
      "support"
    ],
    "risk_level": "low",
    "effective_date": "2026-01-01",
    "expires_at": null,
    "version": "1.3.0",
    "status": "active",
    "content": "这是关于包装与标识的虚构知识条目，仅用于检索、引用和边界测试，不构成真实产品或临床建议。",
    "mock_reference": "mock://knowledge/product/3"
  },
  {
    "doc_id": "KB-0004",
    "title": "附件使用（模拟）",
    "knowledge_domain": "product",
    "product_line": "模拟标准产品线",
    "applicable_roles": [
      "doctor",
      "assistant",
      "support"
    ],
    "risk_level": "low",
    "effective_date": "2026-01-01",
    "expires_at": null,
    "version": "1.4.0",
    "status": "active",
    "content": "这是关于附件使用的虚构知识条目，仅用于检索、引用和边界测试，不构成真实产品或临床建议。",
    "mock_reference": "mock://knowledge/product/4"
  },
  {
    "doc_id": "KB-0005",
    "title": "产品保存（模拟）",
    "knowledge_domain": "product",
    "product_line": "模拟标准产品线",
    "applicable_roles": [
      "doctor",
      "assistant",
      "support"
    ],
    "risk_level": "low",
    "effective_date": "2026-01-01",
    "expires_at": "2026-06-30",
    "version": "1.5.0",
    "status": "expired",
    "content": "这是关于产品保存的虚构知识条目，仅用于检索、引用和边界测试，不构成真实产品或临床建议。",
    "mock_reference": "mock://knowledge/product/5"
  },
  {
    "doc_id": "KB-0006",
    "title": "质保说明（模拟）",
    "knowledge_domain": "product",
    "product_line": "模拟标准产品线",
    "applicable_roles": [
      "doctor",
      "assistant",
      "support"
    ],
    "risk_level": "low",
    "effective_date": "2026-01-01",
    "expires_at": null,
    "version": "1.6.0",
    "status": "conflicted",
    "content": "这是关于质保说明的虚构知识条目，仅用于检索、引用和边界测试，不构成真实产品或临床建议。",
    "mock_reference": "mock://knowledge/product/6"
  },
  {
    "doc_id": "KB-0007",
    "title": "病例提交（模拟）",
    "knowledge_domain": "service_flow",
    "product_line": null,
    "applicable_roles": [
      "doctor",
      "assistant",
      "support"
    ],
    "risk_level": "low",
    "effective_date": "2026-01-01",
    "expires_at": null,
    "version": "1.1.0",
    "status": "active",
    "content": "这是关于病例提交的虚构知识条目，仅用于检索、引用和边界测试，不构成真实产品或临床建议。",
    "mock_reference": "mock://knowledge/service_flow/1"
  },
  {
    "doc_id": "KB-0008",
    "title": "方案确认（模拟）",
    "knowledge_domain": "service_flow",
    "product_line": null,
    "applicable_roles": [
      "doctor",
      "assistant",
      "support"
    ],
    "risk_level": "low",
    "effective_date": "2026-01-01",
    "expires_at": null,
    "version": "1.2.0",
    "status": "active",
    "content": "这是关于方案确认的虚构知识条目，仅用于检索、引用和边界测试，不构成真实产品或临床建议。",
    "mock_reference": "mock://knowledge/service_flow/2"
  },
  {
    "doc_id": "KB-0009",
    "title": "排产流程（模拟）",
    "knowledge_domain": "service_flow",
    "product_line": null,
    "applicable_roles": [
      "doctor",
      "assistant",
      "support"
    ],
    "risk_level": "low",
    "effective_date": "2026-01-01",
    "expires_at": null,
    "version": "1.3.0",
    "status": "active",
    "content": "这是关于排产流程的虚构知识条目，仅用于检索、引用和边界测试，不构成真实产品或临床建议。",
    "mock_reference": "mock://knowledge/service_flow/3"
  },
  {
    "doc_id": "KB-0010",
    "title": "发货查询（模拟）",
    "knowledge_domain": "service_flow",
    "product_line": null,
    "applicable_roles": [
      "doctor",
      "assistant",
      "support"
    ],
    "risk_level": "low",
    "effective_date": "2026-01-01",
    "expires_at": null,
    "version": "1.4.0",
    "status": "active",
    "content": "这是关于发货查询的虚构知识条目，仅用于检索、引用和边界测试，不构成真实产品或临床建议。",
    "mock_reference": "mock://knowledge/service_flow/4"
  },
  {
    "doc_id": "KB-0011",
    "title": "售后申请（模拟）",
    "knowledge_domain": "service_flow",
    "product_line": null,
    "applicable_roles": [
      "doctor",
      "assistant",
      "support"
    ],
    "risk_level": "low",
    "effective_date": "2026-01-01",
    "expires_at": "2026-06-30",
    "version": "1.5.0",
    "status": "expired",
    "content": "这是关于售后申请的虚构知识条目，仅用于检索、引用和边界测试，不构成真实产品或临床建议。",
    "mock_reference": "mock://knowledge/service_flow/5"
  },
  {
    "doc_id": "KB-0012",
    "title": "资料退回（模拟）",
    "knowledge_domain": "service_flow",
    "product_line": null,
    "applicable_roles": [
      "doctor",
      "assistant",
      "support"
    ],
    "risk_level": "low",
    "effective_date": "2026-01-01",
    "expires_at": null,
    "version": "1.6.0",
    "status": "conflicted",
    "content": "这是关于资料退回的虚构知识条目，仅用于检索、引用和边界测试，不构成真实产品或临床建议。",
    "mock_reference": "mock://knowledge/service_flow/6"
  },
  {
    "doc_id": "KB-0013",
    "title": "账号登录（模拟）",
    "knowledge_domain": "system_usage",
    "product_line": null,
    "applicable_roles": [
      "doctor",
      "assistant",
      "support"
    ],
    "risk_level": "low",
    "effective_date": "2026-01-01",
    "expires_at": null,
    "version": "1.1.0",
    "status": "active",
    "content": "这是关于账号登录的虚构知识条目，仅用于检索、引用和边界测试，不构成真实产品或临床建议。",
    "mock_reference": "mock://knowledge/system_usage/1"
  },
  {
    "doc_id": "KB-0014",
    "title": "上传资料（模拟）",
    "knowledge_domain": "system_usage",
    "product_line": null,
    "applicable_roles": [
      "doctor",
      "assistant",
      "support"
    ],
    "risk_level": "low",
    "effective_date": "2026-01-01",
    "expires_at": null,
    "version": "1.2.0",
    "status": "active",
    "content": "这是关于上传资料的虚构知识条目，仅用于检索、引用和边界测试，不构成真实产品或临床建议。",
    "mock_reference": "mock://knowledge/system_usage/2"
  },
  {
    "doc_id": "KB-0015",
    "title": "修改机构信息（模拟）",
    "knowledge_domain": "system_usage",
    "product_line": null,
    "applicable_roles": [
      "doctor",
      "assistant",
      "support"
    ],
    "risk_level": "low",
    "effective_date": "2026-01-01",
    "expires_at": null,
    "version": "1.3.0",
    "status": "active",
    "content": "这是关于修改机构信息的虚构知识条目，仅用于检索、引用和边界测试，不构成真实产品或临床建议。",
    "mock_reference": "mock://knowledge/system_usage/3"
  },
  {
    "doc_id": "KB-0016",
    "title": "查看消息（模拟）",
    "knowledge_domain": "system_usage",
    "product_line": null,
    "applicable_roles": [
      "doctor",
      "assistant",
      "support"
    ],
    "risk_level": "low",
    "effective_date": "2026-01-01",
    "expires_at": null,
    "version": "1.4.0",
    "status": "active",
    "content": "这是关于查看消息的虚构知识条目，仅用于检索、引用和边界测试，不构成真实产品或临床建议。",
    "mock_reference": "mock://knowledge/system_usage/4"
  },
  {
    "doc_id": "KB-0017",
    "title": "重置密码（模拟）",
    "knowledge_domain": "system_usage",
    "product_line": null,
    "applicable_roles": [
      "doctor",
      "assistant",
      "support"
    ],
    "risk_level": "low",
    "effective_date": "2026-01-01",
    "expires_at": "2026-06-30",
    "version": "1.5.0",
    "status": "expired",
    "content": "这是关于重置密码的虚构知识条目，仅用于检索、引用和边界测试，不构成真实产品或临床建议。",
    "mock_reference": "mock://knowledge/system_usage/5"
  },
  {
    "doc_id": "KB-0018",
    "title": "浏览器兼容（模拟）",
    "knowledge_domain": "system_usage",
    "product_line": null,
    "applicable_roles": [
      "doctor",
      "assistant",
      "support"
    ],
    "risk_level": "low",
    "effective_date": "2026-01-01",
    "expires_at": null,
    "version": "1.6.0",
    "status": "conflicted",
    "content": "这是关于浏览器兼容的虚构知识条目，仅用于检索、引用和边界测试，不构成真实产品或临床建议。",
    "mock_reference": "mock://knowledge/system_usage/6"
  },
  {
    "doc_id": "KB-0019",
    "title": "附件术语（模拟）",
    "knowledge_domain": "clinical_term",
    "product_line": null,
    "applicable_roles": [
      "doctor",
      "assistant",
      "support"
    ],
    "risk_level": "medium",
    "effective_date": "2026-01-01",
    "expires_at": null,
    "version": "1.1.0",
    "status": "active",
    "content": "这是关于附件术语的虚构知识条目，仅用于检索、引用和边界测试，不构成真实产品或临床建议。",
    "mock_reference": "mock://knowledge/clinical_term/1"
  },
  {
    "doc_id": "KB-0020",
    "title": "支抗术语（模拟）",
    "knowledge_domain": "clinical_term",
    "product_line": null,
    "applicable_roles": [
      "doctor",
      "assistant",
      "support"
    ],
    "risk_level": "medium",
    "effective_date": "2026-01-01",
    "expires_at": null,
    "version": "1.2.0",
    "status": "active",
    "content": "这是关于支抗术语的虚构知识条目，仅用于检索、引用和边界测试，不构成真实产品或临床建议。",
    "mock_reference": "mock://knowledge/clinical_term/2"
  },
  {
    "doc_id": "KB-0021",
    "title": "邻面去釉术语（模拟）",
    "knowledge_domain": "clinical_term",
    "product_line": null,
    "applicable_roles": [
      "doctor",
      "assistant",
      "support"
    ],
    "risk_level": "medium",
    "effective_date": "2026-01-01",
    "expires_at": null,
    "version": "1.3.0",
    "status": "active",
    "content": "这是关于邻面去釉术语的虚构知识条目，仅用于检索、引用和边界测试，不构成真实产品或临床建议。",
    "mock_reference": "mock://knowledge/clinical_term/3"
  },
  {
    "doc_id": "KB-0022",
    "title": "分步移动术语（模拟）",
    "knowledge_domain": "clinical_term",
    "product_line": null,
    "applicable_roles": [
      "doctor",
      "assistant",
      "support"
    ],
    "risk_level": "medium",
    "effective_date": "2026-01-01",
    "expires_at": null,